{
  "id": "market-manual-001",
  "model_run_id": "run-manual-001",
  "sample_size": 36,
  "test_channel": "controlled synthetic usability panel",
  "perceived_authenticity": 4.1,
  "perceived_cultural_value": 4.0,
  "story_comprehension": 4.2,
  "purchase_intention": 3.7,
  "recommendation_intention": 3.9,
  "recommendation": "revise",
  "report_ref": "synthetic://reports/market-test-manual-001"
}
